{
  "name": "MAKE Adapter",
  "description": "Adapter rules for this stack.",
  "matches": [
    "Makefile",
    "**/*.mk"
  ],
  "content": "# Make Adapter\n\n**Principles**\n- Targets produce files; accurate dependencies; no hidden state; `.PHONY` for non-file targets; rules must be parallel-safe.\n\n**Runbook**\n```\nmake format\nmake lint\nmake test\nmake build\n```\n\n**Formatting**\n- Tabs for recipes; keep variables and target names consistent.\n\n**References**\n- GNU Make Manual â€” https://www.gnu.org/software/make/manual/make.html\n"
}